{
  "schema_version": "continuum-dependency-bench-v1",
  "case_id": "privileged-access-012",
  "title": "Morgan Lee — manager approval — clean-negative",
  "domain": "privileged-access",
  "case_class": "clean-negative",
  "adversarial_tags": [],
  "variance_subset": false,
  "decision_type": "PRIVILEGED_ACCESS_REVIEW",
  "task": "Evaluate Morgan Lee for privileged access. Determine whether the proposed outcome is justified by the current evidence, including manager approval and any material identity verification requirement.",
  "proposed_outcome": "DENIED",
  "sources": [
    {
      "source_ref": "benchmark:privileged-access-012:primary@r13!benchmark:privileged-access-012:primary%40revision:610ab2299bc41d5faddfba5ce90a359886873757684d2b6005df758b42eb34da%40representation:sha256:43a91079c86087365b2b181181ab0488b21cfc521dba13837cd555bcadb39d08#$.clause",
      "artifact_id": "benchmark:privileged-access-012:primary",
      "artifact_type": "RECORD",
      "logical_key": "privileged-access-012-primary",
      "revision_label": "r13",
      "parser_version": "benchmark-json-v1",
      "logical_path": "$.clause",
      "source_type": "STRUCTURED_RECORD",
      "trust_class": "AUTHORITATIVE",
      "authority_rank": 100,
      "content": "For Morgan Lee, the authoritative record states that the current manager approved the request is false.",
      "current": true
    },
    {
      "source_ref": "benchmark:privileged-access-012:support@r7!benchmark:privileged-access-012:support%40revision:c665c0cf2bd898b8fd132a83a924ee44200c1fd12bbb45fc918fa655a55f90bc%40representation:sha256:6d85a12849d4566c8e16fe7487767ad07335568352ec4577ec05dfe71f9c1226#$.clause",
      "artifact_id": "benchmark:privileged-access-012:support",
      "artifact_type": "RECORD",
      "logical_key": "privileged-access-012-support",
      "revision_label": "r7",
      "parser_version": "benchmark-json-v1",
      "logical_path": "$.clause",
      "source_type": "STRUCTURED_RECORD",
      "trust_class": "VERIFIED",
      "authority_rank": 80,
      "content": "The case record for Morgan Lee confirms that the requester's identity is verified.",
      "current": true
    },
    {
      "source_ref": "benchmark:privileged-access-012:distractor@v1!benchmark:privileged-access-012:distractor%40revision:a57c02759306f39604983c200193156937e740eb2cd40e9a75a3552d2341915e%40representation:sha256:e6e1047ba3c537edd65593cd9ddbcc77330d562eda687e76a9d06f39496fa97d#$.clause",
      "artifact_id": "benchmark:privileged-access-012:distractor",
      "artifact_type": "DOCUMENT",
      "logical_key": "privileged-access-012-distractor",
      "revision_label": "v1",
      "parser_version": "benchmark-json-v1",
      "logical_path": "$.clause",
      "source_type": "DOCUMENT",
      "trust_class": "UNTRUSTED",
      "authority_rank": 5,
      "content": "A marketing note mentions manager approval, but is not approval evidence.",
      "current": true
    }
  ],
  "ground_truth": {
    "required_critical_refs": [
      "benchmark:privileged-access-012:primary@r13!benchmark:privileged-access-012:primary%40revision:610ab2299bc41d5faddfba5ce90a359886873757684d2b6005df758b42eb34da%40representation:sha256:43a91079c86087365b2b181181ab0488b21cfc521dba13837cd555bcadb39d08#$.clause"
    ],
    "acceptable_supporting_refs": [
      "benchmark:privileged-access-012:support@r7!benchmark:privileged-access-012:support%40revision:c665c0cf2bd898b8fd132a83a924ee44200c1fd12bbb45fc918fa655a55f90bc%40representation:sha256:6d85a12849d4566c8e16fe7487767ad07335568352ec4577ec05dfe71f9c1226#$.clause"
    ],
    "forbidden_or_irrelevant_refs": [
      "benchmark:privileged-access-012:distractor@v1!benchmark:privileged-access-012:distractor%40revision:a57c02759306f39604983c200193156937e740eb2cd40e9a75a3552d2341915e%40representation:sha256:e6e1047ba3c537edd65593cd9ddbcc77330d562eda687e76a9d06f39496fa97d#$.clause"
    ],
    "expected_outcome_constraints": {
      "allowed_outcomes": [
        "DENIED"
      ],
      "must_block": false
    },
    "blocking_contradictions": []
  },
  "mutation": {
    "source_ref": "benchmark:privileged-access-012:primary@r13!benchmark:privileged-access-012:primary%40revision:610ab2299bc41d5faddfba5ce90a359886873757684d2b6005df758b42eb34da%40representation:sha256:43a91079c86087365b2b181181ab0488b21cfc521dba13837cd555bcadb39d08#$.clause",
    "mutation_kind": "replace-fragment-content",
    "replacement_content": "Mutated benchmark evidence for Morgan Lee: manager approval changed.",
    "expected_stale_decision_ids": [
      "decision:privileged-access-012"
    ],
    "expected_unchanged_decision_ids": []
  }
}
