{
  "schema_version": "continuum-dependency-bench-v1",
  "case_id": "production-release-007",
  "title": "Ledger API — migration backup — near-duplicate",
  "domain": "production-release",
  "case_class": "near-duplicate",
  "adversarial_tags": [
    "near-match"
  ],
  "variance_subset": true,
  "decision_type": "PRODUCTION_RELEASE_REVIEW",
  "task": "Evaluate Ledger API for production release. Determine whether the proposed outcome is justified by the current evidence, including migration backup and any material incident freeze requirement.",
  "proposed_outcome": "APPROVED",
  "sources": [
    {
      "source_ref": "benchmark:production-release-007:near-policy@v13!benchmark:production-release-007:near-policy%40revision:654288a7b390aae81e4a857ff53ca91ee8022bade9ebd2b1e766e72110d5194e%40representation:sha256:220a1e042946106b4ddf63e7da12e795abb208951eefb7380956bb5df8cc71fd#$.binding_clause",
      "artifact_id": "benchmark:production-release-007:near-policy",
      "artifact_type": "POLICY",
      "logical_key": "production-release-007-near-policy",
      "revision_label": "v13",
      "parser_version": "benchmark-json-v1",
      "logical_path": "$.binding_clause",
      "source_type": "POLICY",
      "trust_class": "AUTHORITATIVE",
      "authority_rank": 100,
      "content": "Binding clause for Ledger API: a verified pre-migration backup exists.",
      "current": true
    },
    {
      "source_ref": "benchmark:production-release-007:near-policy@v13!benchmark:production-release-007:near-policy%40revision:654288a7b390aae81e4a857ff53ca91ee8022bade9ebd2b1e766e72110d5194e%40representation:sha256:220a1e042946106b4ddf63e7da12e795abb208951eefb7380956bb5df8cc71fd#$.near_match",
      "artifact_id": "benchmark:production-release-007:near-policy",
      "artifact_type": "POLICY",
      "logical_key": "production-release-007-near-policy",
      "revision_label": "v13",
      "parser_version": "benchmark-json-v1",
      "logical_path": "$.near_match",
      "source_type": "POLICY",
      "trust_class": "AUTHORITATIVE",
      "authority_rank": 100,
      "content": "Similar non-binding example: migration backup may be considered.",
      "current": true
    },
    {
      "source_ref": "benchmark:production-release-007:support@r7!benchmark:production-release-007:support%40revision:e0f13ffd00d1bf37fca16da73598c3c3662f39007f5c5303edec960162031c57%40representation:sha256:46b781ca89ffaa58e4a603b480b50e25d2ba353ad18a553f5108b77f19a42a46#$.clause",
      "artifact_id": "benchmark:production-release-007:support",
      "artifact_type": "RECORD",
      "logical_key": "production-release-007-support",
      "revision_label": "r7",
      "parser_version": "benchmark-json-v1",
      "logical_path": "$.clause",
      "source_type": "STRUCTURED_RECORD",
      "trust_class": "VERIFIED",
      "authority_rank": 80,
      "content": "The case record for Ledger API confirms that no active severity-one incident freeze applies.",
      "current": true
    }
  ],
  "ground_truth": {
    "required_critical_refs": [
      "benchmark:production-release-007:near-policy@v13!benchmark:production-release-007:near-policy%40revision:654288a7b390aae81e4a857ff53ca91ee8022bade9ebd2b1e766e72110d5194e%40representation:sha256:220a1e042946106b4ddf63e7da12e795abb208951eefb7380956bb5df8cc71fd#$.binding_clause"
    ],
    "acceptable_supporting_refs": [
      "benchmark:production-release-007:support@r7!benchmark:production-release-007:support%40revision:e0f13ffd00d1bf37fca16da73598c3c3662f39007f5c5303edec960162031c57%40representation:sha256:46b781ca89ffaa58e4a603b480b50e25d2ba353ad18a553f5108b77f19a42a46#$.clause"
    ],
    "forbidden_or_irrelevant_refs": [
      "benchmark:production-release-007:near-policy@v13!benchmark:production-release-007:near-policy%40revision:654288a7b390aae81e4a857ff53ca91ee8022bade9ebd2b1e766e72110d5194e%40representation:sha256:220a1e042946106b4ddf63e7da12e795abb208951eefb7380956bb5df8cc71fd#$.near_match"
    ],
    "expected_outcome_constraints": {
      "allowed_outcomes": [
        "APPROVED"
      ],
      "must_block": false
    },
    "blocking_contradictions": []
  },
  "mutation": {
    "source_ref": "benchmark:production-release-007:near-policy@v13!benchmark:production-release-007:near-policy%40revision:654288a7b390aae81e4a857ff53ca91ee8022bade9ebd2b1e766e72110d5194e%40representation:sha256:220a1e042946106b4ddf63e7da12e795abb208951eefb7380956bb5df8cc71fd#$.near_match",
    "mutation_kind": "replace-fragment-content",
    "replacement_content": "Mutated benchmark evidence for Ledger API: migration backup changed.",
    "expected_stale_decision_ids": [],
    "expected_unchanged_decision_ids": [
      "decision:production-release-007"
    ]
  }
}
